{"bundle_version":"4.2","run_id":"v42-2-nominal-r2-s1","attempt":"a006","clip_id":"2-nominal-r2","seed":1,"live":false,"exported_at":"2026-10-15T19:14:02+00:00","batch":{"name":"20261015-06-eval-6-v4.2-direction-first","created":"2026-10-15T18:01:42.259469+00:00","candidate_revision":"v4.2"},"provenance":{"sut_commit":"93d0e5b3fffd37e86d5031abde326174aa634a4b","study_commit":"1a2f3fe056d886115c1d45b88438b279604c4a04","service_commit":"7ffc6a8a805019ee64f2e646df50b2136411d5b9","orchestrator":{"model":"nemotron-3.5-lightning-30b-a3b","revision":"bee7596271d1495f6992ae224aefde4410e816b8","temperature":1.0,"top_p":0.95},"perception":{"model":"gemma-4-26b-a4b","revision":"4d7ae4984b7db7de8f8457170b3f1a419ee76d52","temperature":0.1},"tracking":{"contract":"vehicle-tracking-v1","weights_sha256":"646f8bc3fe0a656803d95c294f7852321748cb29d13466a1af8862e2db384a1b"}},"task":{"statement":"How many vehicles, if any, move opposite to the prevailing nearby traffic in the same roadway area? List their colors, and state if the total count remains uncertain.","system":"Answer the video question with six typed tools. Start with context_get, then scan_video once. Read the returned plain-text track summaries. T<n> is a current-session tentative vehicle track, not a global identity. Observed source frames are original zero-based inclusive frame addresses available for investigation. Movement is the primary direction information; coarse screen regions only locate vehicles. Read all inventory pages, compare nearby traffic, select suspicious tracks, then inspect only the visual facts you need. Do not collect every vehicle color in track-ID order.\nFor a specific vehicle, choose its track_ref and factual intent. Example with a fictional valid track: inspect_window({\"track_ref\":\"T_example\",\"intent\":\"appearance_check\"}). The host selects actual observed frames and supplies a marked full image plus a crop. You need not select frames for this mode. scene_check clarifies roadway layout only. observation_get reads existing data; view:\"raw\" explicitly requests coordinates. Repeated scan does not resend the inventory; use observation_get({\"ref\":next_cursor}) when present. Read a track with observation_get({\"ref\":\"T_example\"}); this joins its motion with saved visual evidence. Missing or undisplayed observations do not prove absence.\nEach Gemma call is stateless; fixed intent determines its factual question. reason is optional and audit-only. No shell, Python, free queries or sampling changes. Preserve four calls for deciding and correcting submission. Submit supported count/colors rather than repeatedly retrieving. Accepted submission ends the attempt.\nUse evidence_submit with native JSON values, not strings containing arrays or null. Valid shapes (fictional examples): zero {\"decision\":\"answer\",\"reported_count\":0,\"colors\":[],\"count_complete\":true}; partial {\"decision\":\"answer\",\"reported_count\":1,\"colors\":[\"unknown\"],\"count_complete\":false}; abstain {\"decision\":\"abstain\",\"reported_count\":null,\"colors\":[],\"count_complete\":false}. Answer count equals colors length; repeat colors for distinct same-colored vehicles. Colors are original descriptive strings (1–120 characters), including light shades and multiple body colors; no palette conversion is required. reported_count is the confirmed count you report; count_complete states whether the total is settled. Optional uncertainty <=500 characters. No anchors, intervals, rationale or source_frame_id. Runtime Verifier checks operation/source/shape/resources, not traffic truth.","tools":{"compare_windows":"Compare two track_refs using automatically chosen representative sightings, or provide exactly two advanced source-frame segments. intent must be correspondence_check. Frames are independently labelled, marked full images, no crops. No inferred path across gaps.","context_get":"Read task guidance, source-frame definitions and budgets. No model call.","evidence_submit":"Submit native count/colors/completeness or abstain with null count, [] and false. Partial findings allowed; no formal evidence gate. Correct specific field errors. Accepted ends the attempt.","inspect_window":"Inspect a track with track_ref and factual intent; frames are not required. Appearance uses a representative actual detection, marked full image plus crop. Other target intents use a short fixed-density window. Optional start_frame/end_frame must be supplied together for advanced mode. Targetless scene_check defaults to the middle frame; other targetless intents need a range. reason is optional audit text.","observation_get":"Use one ref: current T<n>, observation, next_cursor, inventory, or unmatched. Track returns motion plus verbatim visual facts and sources. view:\"raw\" requests track/unmatched coordinates; frames only applies there. No model call.","scan_video":"Build the whole-video tracking inventory once. Later calls return status and unread cursor only. Use observation_get({ref:next_cursor}) for remaining summaries. No range or query needed."}},"runtime":{"model_calls":20,"visual_calls":12,"tool_text_total":12000,"tool_text_page":2500,"control_text_reserve":1000,"crop_padding":0.25,"inspect_source_frame_cap":6,"max_inspect_seconds":2,"compare_image_cap":12,"motion_median_points":5,"motion_min_pixels":3,"motion_diagonal_fraction":0.005,"motion_stride_fps_divisor":4,"main_input_target":32000,"memory_summary":"off"},"video":{"fps":10.0,"width":960,"height":540,"nb_frames":199,"duration_sec":19.9,"proxy":"video/2-nominal-r2.mp4"},"tracking":{"classes":{"1":"bicycle","2":"car","3":"motorcycle","5":"bus","7":"truck"},"tracks":[{"alias":"T1","raw_id":2,"observed":[9,39],"phases":[{"start":9,"end":37,"origin":"lower-center","destination":"upper-center","direction":"upward"},{"start":37,"end":39,"origin":"upper-center","destination":"upper-center","direction":"direction unresolved (little observed movement)"}]},{"alias":"T2","raw_id":6,"observed":[15,44],"phases":[{"start":15,"end":44,"origin":"upper-center","destination":"lower-center","direction":"downward"}]},{"alias":"T3","raw_id":8,"observed":[21,24],"phases":[{"start":21,"end":24,"origin":"lower-center","destination":"lower-center","direction":"upward"}]},{"alias":"T4","raw_id":9,"observed":[26,53],"phases":[{"start":26,"end":50,"origin":"middle-center","destination":"upper-center","direction":"upward"},{"start":50,"end":52,"origin":"upper-center","destination":"upper-center","direction":"upward-left"},{"start":52,"end":53,"origin":"upper-center","destination":"upper-center","direction":"direction unresolved (little observed movement)"}]},{"alias":"T5","raw_id":12,"observed":[34,63],"phases":[{"start":34,"end":57,"origin":"lower-center","destination":"upper-center","direction":"upward"},{"start":59,"end":63,"origin":"upper-center","destination":"upper-center","direction":"upward"}]},{"alias":"T6","raw_id":18,"observed":[49,78],"phases":[{"start":49,"end":75,"origin":"lower-center","destination":"upper-center","direction":"upward"},{"start":75,"end":78,"origin":"upper-center","destination":"upper-center","direction":"direction unresolved (little observed movement)"}]},{"alias":"T7","raw_id":20,"observed":[56,58],"phases":[{"start":56,"end":58,"origin":"upper-center","destination":"upper-center","direction":"direction unresolved (little observed movement)"}]},{"alias":"T8","raw_id":22,"observed":[60,85],"phases":[{"start":60,"end":85,"origin":"upper-center","destination":"lower-center","direction":"downward"}]},{"alias":"T9","raw_id":36,"observed":[71,89],"phases":[{"start":71,"end":89,"origin":"upper-center","destination":"upper-center","direction":"upward"}]},{"alias":"T10","raw_id":38,"observed":[72,127],"phases":[{"start":72,"end":73,"origin":"lower-center","destination":"lower-center","direction":"upward"},{"start":86,"end":86,"origin":"lower-center","destination":"lower-center","direction":"direction unresolved"},{"start":99,"end":99,"origin":"lower-center","destination":"lower-center","direction":"direction unresolved"},{"start":112,"end":112,"origin":"lower-center","destination":"lower-center","direction":"direction unresolved"},{"start":124,"end":125,"origin":"lower-right","destination":"lower-right","direction":"upward"},{"start":125,"end":126,"origin":"lower-right","destination":"lower-center","direction":"upward-left"},{"start":126,"end":127,"origin":"lower-center","destination":"middle-center","direction":"upward"}]},{"alias":"T11","raw_id":39,"observed":[75,104],"phases":[{"start":75,"end":101,"origin":"lower-center","destination":"upper-center","direction":"upward"},{"start":101,"end":103,"origin":"upper-center","destination":"upper-center","direction":"upward-left"},{"start":103,"end":104,"origin":"upper-center","destination":"upper-center","direction":"direction unresolved (little observed movement)"}]},{"alias":"T12","raw_id":47,"observed":[88,129],"phases":[{"start":88,"end":88,"origin":"middle-center","destination":"middle-center","direction":"direction unresolved"},{"start":100,"end":128,"origin":"lower-center","destination":"upper-center","direction":"upward"},{"start":128,"end":129,"origin":"upper-center","destination":"upper-center","direction":"direction unresolved (little observed movement)"}]},{"alias":"T13","raw_id":51,"observed":[91,115],"phases":[{"start":91,"end":113,"origin":"middle-center","destination":"upper-center","direction":"upward"},{"start":113,"end":115,"origin":"upper-center","destination":"upper-center","direction":"upward-left"}]},{"alias":"T14","raw_id":55,"observed":[97,140],"phases":[{"start":97,"end":98,"origin":"lower-right","destination":"lower-center","direction":"upward"},{"start":113,"end":113,"origin":"lower-center","destination":"lower-center","direction":"direction unresolved"},{"start":128,"end":140,"origin":"middle-center","destination":"upper-center","direction":"upward"}]},{"alias":"T15","raw_id":65,"observed":[115,139],"phases":[{"start":115,"end":139,"origin":"midd